<!ELEMENT cine (directores,peliculas)>
    <!ELEMENT directores (director)*>
        <!ELEMENT director (#PCDATA)>
        <!ATTLIST director coddir ID #REQUIRED>

    <!ELEMENT peliculas (pelicula)*>
        <!ELEMENT pelicula (#PCDATA)>
            <!ATTLIST pelicula direccion IDREF #REQUIRED>