<?xml version="1.0" encoding="utf-8" standalone="no"?>
<!DOCTYPE cine SYSTEM "cine.dtd">
<cine>
    <directores>
        <director coddir="CE">Clint Eastwood</director>
        <director coddir="JC">James Cameron</director>
    </directores>
    <peliculas>
        <pelicula direccion="JC">Avatar</pelicula>
        <pelicula direccion="CE">Mystic River</pelicula>
        <pelicula direccion="JC">Titanic</pelicula>
    </peliculas>
</cine>